{
  "kind": "mindmap",
  "subjectCode": "GEO",
  "topic": "Earth in the Solar System & Its Motions",
  "subtopicId": "geo-earth-solar-system",
  "root": "Earth & Solar System",
  "branches": [
    {
      "label": "Solar system",
      "leaves": [
        "Nebular hypothesis, 4.6 bya",
        "Terrestrial vs Jovian",
        "Asteroid/Kuiper/Oort",
        "1 AU ≈ 150 million km"
      ]
    },
    {
      "label": "Planet facts",
      "leaves": [
        "Venus hottest/retrograde",
        "Neptune fastest winds",
        "Uranus tilted axis",
        "Jupiter largest; Ganymede"
      ]
    },
    {
      "label": "Dwarf/small bodies",
      "leaves": [
        "Not cleared orbit",
        "Ceres/Pluto/Eris/Haumea/Makemake",
        "Charon = moon",
        "Meteoroid→meteor→meteorite"
      ]
    },
    {
      "label": "Sun & Moon",
      "leaves": [
        "75%H/24%He; 99.86% mass",
        "Sunspots cooler; 8m20s",
        "Moon phases ~29 d",
        "Giant-impact origin"
      ]
    },
    {
      "label": "Eclipses",
      "leaves": [
        "Solar=new; Lunar=full",
        "Umbra/penumbra/antumbra",
        "5° tilt → need node",
        "Saros ~18y 11d"
      ]
    },
    {
      "label": "Earth motions",
      "leaves": [
        "Rotation: day/night, Coriolis",
        "Axis 66½° = 23½° tilt",
        "Revolution 365¼; leap year",
        "Aphelion Jul; perihelion Jan"
      ]
    },
    {
      "label": "Lat/Long/Time",
      "leaves": [
        "Tropics 23½°; circles 66½°",
        "1°≈111 km; Torrid/Temperate/Frigid",
        "15°=1h; 1°=4 min",
        "IST 82½°E = GMT+5:30"
      ]
    }
  ]
}
