{
  "kind": "mindmap",
  "subjectCode": "ECON",
  "topic": "Characteristics of the Indian Economy & Development",
  "subtopicId": "econ-characteristics-development",
  "root": "Indian Economy & Development",
  "branches": [
    {
      "label": "Growth vs Development",
      "leaves": [
        "Growth = quantitative income",
        "Development = + welfare/equity",
        "Growth necessary not sufficient",
        "Inclusive vs jobless growth"
      ]
    },
    {
      "label": "Developing features",
      "leaves": [
        "Low per-capita income",
        "Economic dualism",
        "Capital deficiency",
        "Agrarian, informal, poverty"
      ]
    },
    {
      "label": "Sectors",
      "leaves": [
        "Primary/Secondary/Tertiary",
        "Quaternary/Quinary",
        "GVA 17.7/27.6/54.7%",
        "8 core industries"
      ]
    },
    {
      "label": "National income",
      "leaves": [
        "GNP=GDP+NFIA",
        "NNP=GNP−Depreciation",
        "Factor cost=MP−IT+subsidy",
        "3 methods; deflator; base 2011-12"
      ]
    },
    {
      "label": "Measuring development",
      "leaves": [
        "HDI: health/edu/income",
        "India 0.685, rank 130/193",
        "Demographic dividend",
        "PPP vs nominal GDP"
      ]
    },
    {
      "label": "Black money",
      "leaves": [
        "SIT 2014 — M.B. Shah",
        "PMLA 2002 — ED",
        "Place-Layer-Integrate",
        "Foreign Assets Act 2015"
      ]
    },
    {
      "label": "AP economy",
      "leaves": [
        "GSDP ~₹19.75 lakh cr",
        "Per-capita ~₹2.98 lakh",
        "Primary ~35-37% GSVA",
        "Agrarian-heavy vs India"
      ]
    }
  ]
}
