{
  "kind": "mindmap",
  "subjectCode": "HIST",
  "topic": "Buddhism II",
  "subtopicId": "hist-ancient-buddhism-2",
  "root": "Buddhist Schools, Councils & Art",
  "branches": [
    {
      "label": "Texts",
      "leaves": [
        "Tripitaka (Pali)",
        "Vinaya/Sutta/Abhidhamma",
        "Milinda Panho",
        "Buddhacharita"
      ]
    },
    {
      "label": "Schools",
      "leaves": [
        "Hinayana/Theravada",
        "Mahayana (Bodhisattva)",
        "Vajrayana (Tantric)",
        "Mahasanghika→Mahayana"
      ]
    },
    {
      "label": "Bodhisattva",
      "leaves": [
        "Paramitas (perfections)",
        "Maitreya (future)",
        "Avalokiteshvara/Padmapani",
        "Image worship"
      ]
    },
    {
      "label": "Councils",
      "leaves": [
        "1st Rajagriha–Ajatashatru",
        "3rd Pataliputra–Ashoka/Tissa",
        "4th Kashmir–Kanishka",
        "Vasumitra president"
      ]
    },
    {
      "label": "Art",
      "leaves": [
        "Gandhara: grey schist",
        "Mathura: red sandstone",
        "Amaravati: white marble",
        "Sarnath Lion Capital"
      ]
    },
    {
      "label": "Architecture",
      "leaves": [
        "Chaitya = worship hall",
        "Vihara = residence",
        "Stupa (Ashoka's 84,000)",
        "Kanganahalli 'Ranyo Ashoka'"
      ]
    }
  ]
}
