{
  "kind": "mindmap",
  "subjectCode": "HIST",
  "topic": "Governor-Generals & Viceroys",
  "subtopicId": "hist-modern-governors-viceroys",
  "root": "GGs & Viceroys",
  "branches": [
    {"label":"Early GG Bengal","leaves":["Hastings 1773 (Regulating Act)","Cornwallis Permanent Settlement 1793","Wellesley Subsidiary Alliance 1798","Fort William College 1800"]},
    {"label":"Reformers","leaves":["Bentinck Sati 1829","1st GG of India 1833","English Education 1835","Dalhousie Doctrine of Lapse"]},
    {"label":"Crown transition","leaves":["Canning last GG/1st Viceroy","GoI Act 1858 (ends EIC)","Queen's Proclamation 1858","Councils Act 1861"]},
    {"label":"Early Viceroys","leaves":["Mayo Census 1872","Lytton Vernacular Press 1878","Ripon repeals it/Ilbert Bill","Dufferin INC 1885"]},
    {"label":"Partition era","leaves":["Curzon partitions Bengal 1905","Minto II Morley-Minto 1909","Hardinge annuls 1911→Delhi","Muslim League 1906"]},
    {"label":"Towards freedom","leaves":["Chelmsford 1919/Jallianwala","Irwin Gandhi-Irwin 1931","Linlithgow Quit India 1942","Mountbatten June 3 Plan 1947"]},
    {"label":"Settlements & bodies","leaves":["Ryotwari Read/Munro","Mahalwari Mackenzie/Bird","Butler Committee 1927","Wood's Dispatch 1854"]}
  ]
}
