{
  "kind": "mindmap",
  "subjectCode": "ECON",
  "topic": "Fiscal Policy, Budget & GST",
  "subtopicId": "econ-fiscal-budget-gst",
  "root": "Fiscal, Budget & GST",
  "branches": [
    {"label":"Fiscal policy","leaves":["Govt revenue + spending","Counter-cyclical=opposite","Expansionary vs contract.","Run by MoF, not RBI"]},
    {"label":"Budget basics","leaves":["Art 112 AFS","1 Feb; plan/non-plan gone","3 funds: CFI/PA/CFI-Cont","Approp. before Finance Bill"]},
    {"label":"Deficits","leaves":["FD=Exp−non-borrow receipts","PD=FD−interest","ERD=RD−capital grants","Monetise=most inflationary"]},
    {"label":"FRBM 2003","leaves":["FD ≤3% GDP","Debt ≤60% GDP","Escape clause 4(2)","NK Singh 2016 anchor"]},
    {"label":"Taxes","leaves":["Direct CBDT / Indirect CBIC","Wealth 2016, DDT 2020 gone","VAT = State subject","BEPS = MNC evasion"]},
    {"label":"GST","leaves":["101st Amdt; 1 Jul 2017","Council Art 279A, 3/4","GST 2.0: 5/18/40","Petrol/alcohol outside"]},
    {"label":"FC & AP","leaves":["Art 280; 14th 32→42%","16th Panagariya 2026-31","AP FD 3.8%, RD 1.1%","AP FRBM 2005"]}
  ]
}
