{
  "kind": "mindmap",
  "subjectCode": "HIST",
  "topic": "1857 War of Independence",
  "subtopicId": "hist-modern-1857-revolt",
  "root": "Revolt of 1857",
  "branches": [
    {"label":"Causes","leaves":["Political: Doctrine of Lapse, Awadh 1856","Economic: deindustrialization","Socio-religious: Act 1850","Military: Enlistment Act 1856"]},
    {"label":"Spark & outbreak","leaves":["Greased Enfield cartridge","Mangal Pandey Barrackpore 29 Mar","Meerut 10 May 1857","Delhi → Bahadur Shah Zafar"]},
    {"label":"Centres & leaders","leaves":["Kanpur Nana Sahib/Tatya Tope","Lucknow Hazrat Mahal","Jhansi Rani Lakshmi Bai","Arrah Kunwar Singh"]},
    {"label":"Failure","leaves":["Limited to North India","No unified leadership","British arms + telegraph","Loyal states (Gwalior/Hyderabad)"]},
    {"label":"Consequences","leaves":["GoI Act 1858 (Crown rule)","Secretary of State + Viceroy","Queen's Proclamation 1858","Peel Commission army reform"]},
    {"label":"Tribal/peasant revolts","leaves":["Ulgulan = Birsa Munda 1899","Santhal Hul 1855 (Sidhu-Kanhu)","Kol 1831 / Sanyasi","Indigo 1859-60"]},
    {"label":"Andhra angle","leaves":["Deccan largely quiet","Nizam backed British","Narasimha Reddy 1846-47","Hanged Koilkuntla 1847"]}
  ]
}
