{
  "kind": "mindmap",
  "subjectCode": "HIST",
  "topic": "Travelers in Ancient India",
  "subtopicId": "hist-ancient-travelers",
  "root": "Foreign Travellers",
  "branches": [
    {
      "label": "Greek/Roman",
      "leaves": [
        "Ktesias — Persian court (5C BCE)",
        "Megasthenes — Indica",
        "Ptolemy — Geographia",
        "Pliny — drain of gold"
      ]
    },
    {
      "label": "Chinese pilgrims",
      "leaves": [
        "Fa-Hien — Chandragupta II",
        "Hiuen-Tsang — Harsha, Si-Yu-Ki",
        "I-Tsing — sea route, Nalanda",
        "Ma Huan — Zheng He (15C)"
      ]
    },
    {
      "label": "Envoy → king",
      "leaves": [
        "Megasthenes → Chandragupta M.",
        "Deimachus → Bindusara",
        "Dionysius → Mauryan court",
        "Marco Polo → Pandya (Madurai)"
      ]
    },
    {
      "label": "Accounts",
      "leaves": [
        "Indica — Megasthenes/Ktesias",
        "Geographia — Ptolemy",
        "Si-Yu-Ki — Hiuen-Tsang",
        "Naturalis Historia — Pliny"
      ]
    },
    {
      "label": "Chronology",
      "leaves": [
        "Ktesias→Megasthenes→Dionysius",
        "Pliny→Ptolemy",
        "Fa-Hien→Hiuen-Tsang→I-Tsing",
        "Ma Huan last (15C)"
      ]
    },
    {
      "label": "Nalanda link",
      "leaves": [
        "Hiuen-Tsang studied there",
        "I-Tsing studied there",
        "Both 7th century",
        "Mahayana learning"
      ]
    },
    {
      "label": "Why they came",
      "leaves": [
        "Trade — spices/textiles/gems",
        "Spread Buddhism",
        "Diplomacy",
        "Learning (philosophy/medicine)"
      ]
    }
  ]
}
