{
  "kind": "mindmap",
  "subjectCode": "HIST",
  "topic": "Buddhism I",
  "subtopicId": "hist-ancient-buddhism-1",
  "root": "Buddha's Life & Teachings",
  "branches": [
    {
      "label": "Identity",
      "leaves": [
        "Siddhartha Gautama",
        "Sakya, Kapilvastu",
        "Suddhodana & Mahamaya",
        "Tathagata/Sakyamuni"
      ]
    },
    {
      "label": "Life-arc",
      "leaves": [
        "Born Lumbini, 563 BCE",
        "Renounce 29, 6 yrs austerity",
        "Enlighten 35 (Bodh Gaya)",
        "Death 80 (Kushinagar)"
      ]
    },
    {
      "label": "4 Sites",
      "leaves": [
        "Lumbini: birth",
        "Bodh Gaya: enlightenment",
        "Sarnath: first sermon",
        "Kushinagar: nirvana"
      ]
    },
    {
      "label": "4 Noble Truths",
      "leaves": [
        "Dukkha (suffering)",
        "Samudaya = Trishna",
        "Nirodha = Nirvana",
        "Marga = 8-fold path"
      ]
    },
    {
      "label": "Path/Jewels",
      "leaves": [
        "Eightfold Path",
        "Middle Path",
        "Triratna: Buddha/Dhamma/Sangha",
        "Nirvana = end of desire"
      ]
    },
    {
      "label": "Beliefs",
      "leaves": [
        "Ahimsa",
        "Anatman (no soul)",
        "No creator God",
        "Karma over birth"
      ]
    }
  ]
}
