{
  "kind": "mindmap",
  "subjectCode": "CA",
  "topic": "National Current Affairs (Nov 2025 - Oct 2026)",
  "subtopicId": "ca-national",
  "root": "National CA 2026",
  "branches": [
    {"label":"Constitutional posts","leaves":["CJI Surya Kant (53rd)","VP C.P. Radhakrishnan","CEC Gyanesh Kumar","RBI Guv Sanjay Malhotra"]},
    {"label":"Economy/Budget","leaves":["Budget 1 Feb 2026 (Sitharaman)","Survey FY26 GDP 7.4%","Income Tax Act 2025","FY27 outlook 6.8-7.2%"]},
    {"label":"Schemes/Laws","leaves":["VB-G RAM G (125 days)","replaces MGNREGA","Nat'l Dental Commission","Excise Bill 2025 tobacco"]},
    {"label":"Honours","leaves":["Padma 2026 = 131","5 Vibhushan","Dharmendra, Achuthanandan","No Bharat Ratna"]},
    {"label":"Reports/Indices","leaves":["Asia Power 3rd","CCPI 23rd","Henley 80th","Milk No.1 ~248 MT"]},
    {"label":"Defence/Space","leaves":["INS Aridaman 3rd SSBN","INS Mahe ASW-SWC","LRLACM cruise missile","NISAR NASA-ISRO"]},
    {"label":"Sports","leaves":["T20 WC: India champions","beat NZ by 96 runs","8 Mar 2026 Ahmedabad","India-SL co-hosts"]}
  ]
}
