{
  "kind": "mindmap",
  "subjectCode": "HIST",
  "topic": "Qutb Shahis of Golconda",
  "subtopicId": "hist-ap-qutb-shahis",
  "root": "Qutb Shahis (1518–1687)",
  "branches": [
    {
      "label": "Origin",
      "leaves": [
        "Sultan Quli 1518",
        "Ex-Bahmani governor",
        "Shia/Turkoman/Persianate",
        "= old Warangal region"
      ]
    },
    {
      "label": "Ibrahim Quli",
      "leaves": [
        "r.1550–80",
        "'Malkibharam'",
        "Telugu patron",
        "Hussain Sagar"
      ]
    },
    {
      "label": "Muhammad Quli",
      "leaves": [
        "r.1580–1611",
        "Founded Hyderabad 1591",
        "Charminar",
        "Kulliyat (Urdu diwan)"
      ]
    },
    {
      "label": "Monuments",
      "leaves": [
        "Charminar (granite/lime)",
        "Golconda Fort",
        "Makkah Masjid",
        "Qutb Shahi Tombs"
      ]
    },
    {
      "label": "Economy",
      "leaves": [
        "Golconda diamonds",
        "Kollur mine",
        "Koh-i-Noor, Hope",
        "Masulipatnam port"
      ]
    },
    {
      "label": "Fall 1687",
      "leaves": [
        "Abul Hasan Tana Shah",
        "Aurangzeb's siege",
        "Madanna & Akkanna",
        "Bhakta Ramadasu"
      ]
    },
    {
      "label": "After",
      "leaves": [
        "Mughal Deccan",
        "Asaf Jah I 1724",
        "Hyderabad State",
        "Bhagmati/Bhagyanagar"
      ]
    }
  ]
}
