{
  "kind": "mindmap",
  "subjectCode": "POL",
  "topic": "The Judiciary",
  "subtopicId": "pol-judiciary",
  "root": "The Judiciary",
  "branches": [
    {
      "label": "Supreme Court",
      "leaves": [
        "Art 124-147; 28 Jan 1950",
        "Strength 38 (1+37) since 2026",
        "Parliament sets number",
        "Custodian of Constitution"
      ]
    },
    {
      "label": "Jurisdiction",
      "leaves": [
        "131 original (Centre-State)",
        "32 writs, 136 SLP",
        "143 advisory",
        "141 binding, 142 justice"
      ]
    },
    {
      "label": "Appointment",
      "leaves": [
        "President via Collegium",
        "NJAC struck 2015",
        "Retire 65 (SC), 62 (HC)",
        "124(4) removal, Inquiry Act"
      ]
    },
    {
      "label": "High Courts",
      "leaves": [
        "Art 214-231; 25 HCs",
        "226 wider than 32",
        "215 court of record",
        "227 superintendence"
      ]
    },
    {
      "label": "Writs & contempt",
      "leaves": [
        "5 writs (HM-PCQ)",
        "Mandamus: public duty",
        "Quo Warranto: any person",
        "Contempt Act 1971"
      ]
    },
    {
      "label": "Access & AP",
      "leaves": [
        "NALSA 1987 (Art 39A)",
        "Lok Adalat final",
        "Sub courts 233-237",
        "AP HC Amaravati 2019"
      ]
    }
  ]
}
