{
  "kind": "mindmap",
  "subjectCode": "HIST",
  "topic": "Indo-Greeks",
  "subtopicId": "hist-ancient-indo-greek",
  "root": "Indo-Greeks / Indo-Bactrians",
  "branches": [
    {
      "label": "Origins",
      "leaves": [
        "Bactria from Seleucids",
        "Diodotus secession",
        "Demetrius I invades ~180 BCE",
        "Antiochus III"
      ]
    },
    {
      "label": "Menander I",
      "leaves": [
        "'Soter', capital Sakala",
        "Milinda Panho / Nagasena",
        "Patron of Buddhism",
        "Widest coinage"
      ]
    },
    {
      "label": "Heliodorus",
      "leaves": [
        "Pillar at Besnagar/Vidisha",
        "Envoy of Antialcidas",
        "To king Bhagabhadra",
        "Dedicated to Vasudeva"
      ]
    },
    {
      "label": "Coinage",
      "leaves": [
        "Bilingual Greek+Kharosthi",
        "First gold coins",
        "Portrait coins",
        "Greek gods + Indian"
      ]
    },
    {
      "label": "Contacts",
      "leaves": [
        "Ashoka RE-13 Yona kings",
        "Seleucus–Chandragupta 305",
        "Megasthenes envoy",
        "Gandhara art"
      ]
    },
    {
      "label": "Decline",
      "leaves": [
        "Strato II (last)",
        "Shakas / Yuezhi",
        "Kushana takeover",
        "Numismatic legacy"
      ]
    }
  ]
}
