{
  "kind": "mindmap",
  "subjectCode": "HIST",
  "topic": "South Indian Dynasties (Rashtrakutas, Cholas, Kakatiyas, Hoysalas, Yadavas)",
  "subtopicId": "hist-medieval-south-indian-dynasties",
  "root": "South Indian Dynasties",
  "branches": [
    {"label":"Rashtrakutas (753)","leaves":["Dantidurga founder","Krishna I — Kailasa/Ellora","Amoghavarsha — Manyakheta, Kavirajamarga","Govinda III conqueror"]},
    {"label":"Chola kings","leaves":["Rajaraja I — Brihadeeswara","Rajendra I — Gangaikonda, navy","Kulottunga I — Vengi, tolls off","Bay of Bengal power"]},
    {"label":"Chola local govt","leaves":["Uttaramerur — Parantaka I","kudavolai (pot-ticket)","Ur / Brahmadeya / Devadana","variyam committees"]},
    {"label":"Chola art","leaves":["3 UNESCO Living temples","Dravidian vimana/gopura","Nataraja bronze","Dakshina Meru"]},
    {"label":"Kakatiyas (Warangal)","leaves":["Ganapati Deva — Pakhal/Motupalli","Rudrama Devi — Marco Polo","Prataparudra II — fell 1323","Ramappa (UNESCO 2021)"]},
    {"label":"Hoysalas & Yadavas","leaves":["Vishnuvardhana — Belur/Halebidu","Madurai 1343 — Ballala III","Yadavas — Devagiri, Marathi","Hemadpanti; Malik Kafur"]},
    {"label":"Marathas (Shivaji)","leaves":["Raigad 1674 Chhatrapati","Ashtapradhan (Peshwa=PM)","Chauth 1/4, Sardeshmukhi 1/10","forts & navy"]}
  ]
}
