{
  "kind": "mindmap",
  "subjectCode": "HIST",
  "topic": "The Delhi Sultanate",
  "subtopicId": "hist-medieval-delhi-sultanate",
  "root": "Delhi Sultanate 1206-1526",
  "branches": [
    {"label":"Foundation","leaves":["Tarain 1191/1192","Chandawar 1194 — Jaichandra","Aibak declares 1206","5 dynasties: SKTSL"]},
    {"label":"Slave/Mamluk","leaves":["Aibak — Lakh Baksh, Qutb Minar","Iltutmish — tanka, iqta, Chihalgani","Razia — only woman","Balban — sijda/paibos"]},
    {"label":"Khalji — Alauddin","leaves":["Malik Kafur — Deccan 4","market/price control","Dagh & Chehra","cash standing army"]},
    {"label":"Tughlaqs","leaves":["Ghiyasuddin — Tughlaqabad","MBT — Daulatabad, token coin","Firoz — canals, jizya-Brahmin","Timur 1398"]},
    {"label":"Sayyid & Lodi","leaves":["Khizr Khan 1414","Bahlol — 1st Afghan","Sikandar — Agra 1504","Ibrahim — Panipat 1526"]},
    {"label":"Administration","leaves":["iqta — non-hereditary","Diwan-i-Wizarat/Arz/Insha","muqtis maintain troops"]},
    {"label":"Culture & sources","leaves":["true arch & dome","Alai Darwaza 1311","Barani, Minhaj, Khusrau","Ibn Battuta — Rihla"]}
  ]
}
