{
  "kind": "mindmap",
  "subjectCode": "SCI",
  "topic": "ICT, e-Governance & Cyber Security",
  "subtopicId": "sci-ict-egovernance-cyber",
  "root": "ICT & e-Gov",
  "branches": [
    {
      "label": "Blockchain/Web3",
      "leaves": [
        "decentralised ledger",
        "NFT=unique",
        "crypto=fungible",
        "Web3 user-owned"
      ]
    },
    {
      "label": "Cloud & comms",
      "leaves": [
        "IaaS/PaaS/SaaS",
        "NFC ~4 cm",
        "Li-Fi 375–780 nm",
        "VoLTE; Project Loon"
      ]
    },
    {
      "label": "India Stack",
      "leaves": [
        "Aadhaar/UPI",
        "DigiLocker/AA",
        "ONDC commerce",
        "CoWIN health"
      ]
    },
    {
      "label": "Data & cyber law",
      "leaves": [
        "DPDP 2023 ₹250cr",
        "Rules 2025",
        "66A struck 2015",
        "IT Act 2000"
      ]
    },
    {
      "label": "Cyber security",
      "leaves": [
        "CERT-In 70B",
        "NCIIPC 70A",
        "I4C 1930",
        "6-hour report"
      ]
    },
    {
      "label": "Missions",
      "leaves": [
        "IndiaAI ₹10,372cr",
        "NQM ₹6,003cr",
        "Semicon Dholera",
        "PARAM Rudra"
      ]
    },
    {
      "label": "AP e-gov",
      "leaves": [
        "RTGS centre",
        "Mana Mitra WhatsApp",
        "e-Pragati",
        "Amaravati Quantum"
      ]
    }
  ]
}