{
  "kind": "mindmap",
  "subjectCode": "POL",
  "topic": "Salient Features & the Preamble",
  "subtopicId": "pol-constitution-features-preamble",
  "root": "Features & Preamble",
  "branches": [
    {"label":"Salient features","leaves":["Lengthiest written","Quasi-federal (Art 1)","Parliamentary system","Single citizenship"]},
    {"label":"Borrowed sources","leaves":["US: FR, judicial review","Irish: DPSP","Soviet: Fund. Duties","Canada: strong centre"]},
    {"label":"Preamble text","leaves":["Objectives Resolution","We the People","Sovereign Socialist Secular","Justice Liberty Equality"]},
    {"label":"42nd Amdt 1976","leaves":["Socialist","Secular","Integrity","amended once only"]},
    {"label":"Preamble status","leaves":["Berubari: not part","Kesavananda: is part","LIC 1995 integral","non-justiciable"]},
    {"label":"Parts & Schedules","leaves":["III FR / IV DPSP","IVA Duties (51A)","8th=22 languages","10th anti-defection"]}
  ]
}
