{
  "kind": "mindmap",
  "subjectCode": "ECON",
  "topic": "Poverty & Unemployment",
  "subtopicId": "econ-poverty-unemployment",
  "root": "Poverty & Unemployment",
  "branches": [
    {
      "label": "Poverty line",
      "leaves": [
        "2400 rural / 2100 urban kcal",
        "Absolute vs relative",
        "HCR = incidence",
        "Poverty gap = depth"
      ]
    },
    {
      "label": "Committees",
      "leaves": [
        "Alagh 1979 (calorie)",
        "Lakdawala 1993 (state)",
        "Tendulkar 2009 = 21.9%",
        "Rangarajan 2014 = 29.5%"
      ]
    },
    {
      "label": "MPI",
      "leaves": [
        "Global: OPHI+UNDP, 10 ind",
        "National: 12 ind (NITI)",
        "Alkire-Foster method",
        "29.17%→11.28% (24.82 cr)"
      ]
    },
    {
      "label": "Unemployment types",
      "leaves": [
        "Structural/Frictional",
        "Cyclical/Seasonal",
        "Disguised (MP≈0)",
        "Lewis surplus labour"
      ]
    },
    {
      "label": "PLFS",
      "leaves": [
        "2017, replaced EUS",
        "UPS/CWS/CDS",
        "LFPR/WPR/UR",
        "Monthly from Jan 2025"
      ]
    },
    {
      "label": "Schemes",
      "leaves": [
        "MGNREGA 100 days, ABPS",
        "VB-G RAM G 2025 repeal",
        "PMEGP/DDU-GKY/e-Shram",
        "IRDP→SGSY→NRLM"
      ]
    }
  ]
}
