{
  "kind": "mindmap",
  "subjectCode": "GEO",
  "topic": "Social/Human Geography",
  "subtopicId": "geo-social-geography",
  "root": "Human Geography",
  "branches": [
    {
      "label": "Census 2011",
      "leaves": [
        "121 cr; 382/km²",
        "growth 17.7%",
        "urban 31.16%",
        "literacy 74.04%"
      ]
    },
    {
      "label": "Sex ratios",
      "leaves": [
        "943 overall",
        "CSR 919",
        "Kerala high 1084",
        "Haryana low 879"
      ]
    },
    {
      "label": "Population theory",
      "leaves": [
        "4 transition stages",
        "dividend to 2055",
        "CBR/CDR/TFR",
        "distribution controls"
      ]
    },
    {
      "label": "Migration",
      "leaves": [
        "rural-rural largest",
        "female=marriage",
        "male=work",
        "push–pull"
      ]
    },
    {
      "label": "Tribes/PVTG",
      "leaves": [
        "75 PVTGs",
        "Yanadi largest AP ST",
        "Chenchu Nallamala",
        "Karbi=Assam"
      ]
    },
    {
      "label": "Settlements",
      "leaves": [
        "nucleated/dispersed",
        "linear/hamleted",
        "urban hierarchy",
        "million-plus city"
      ]
    },
    {
      "label": "Current",
      "leaves": [
        "most populous 2023",
        "Census 2027 digital",
        "PM-JANMAN",
        "caste count"
      ]
    }
  ]
}