{
  "kind": "mindmap",
  "subjectCode": "POL",
  "topic": "Fundamental Rights",
  "subtopicId": "pol-fundamental-rights",
  "root": "Fundamental Rights",
  "branches": [
    {
      "label": "Frame",
      "leaves": [
        "Part III: Art 12-35",
        "Six FRs (was 7)",
        "Art 12 State, Art 13 review",
        "US Bill + UDHR"
      ]
    },
    {
      "label": "Equality 14-18",
      "leaves": [
        "14: before law + equal protn",
        "15/16: no discrimn, reservn",
        "17: untouchability",
        "18: titles (mil/acad exempt)"
      ]
    },
    {
      "label": "Freedom 19-22",
      "leaves": [
        "19: six freedoms",
        "20: ex-post, double jeopardy",
        "21: life; 21A educn 6-14",
        "22: arrest, preventive det."
      ]
    },
    {
      "label": "Other rights",
      "leaves": [
        "23-24: exploitation",
        "25-28: religion",
        "29-30: minorities",
        "32: remedies, 5 writs"
      ]
    },
    {
      "label": "Property & privacy",
      "leaves": [
        "Property: Art 300A (44th)",
        "Privacy: Art 21 Puttaswamy",
        "Vote: constitutional right",
        "226 wider than 32"
      ]
    },
    {
      "label": "Limits",
      "leaves": [
        "33 armed forces, 34 martial",
        "35 Parliament power",
        "31B Ninth Schedule",
        "20 & 21 never suspended"
      ]
    }
  ]
}
