{
  "kind": "mindmap",
  "subjectCode": "HIST",
  "topic": "Books & Authors of Ancient India",
  "subtopicId": "hist-ancient-books-authors",
  "root": "Books & Authors",
  "branches": [
    {
      "label": "Vedic corpus",
      "leaves": [
        "4 Vedas: Rig/Sama/Yajur/Atharva",
        "Yajnavalkya — Shatapatha+Brihadaranyaka",
        "Kapila — Samkhya",
        "Manu — Manusmriti"
      ]
    },
    {
      "label": "Buddhist",
      "leaves": [
        "Tripitaka (Pali)",
        "Nagasena — Milinda Panha",
        "Ashvaghosha — Buddhacharita",
        "Buddhaghosa — Visuddhimagga"
      ]
    },
    {
      "label": "Jaina",
      "leaves": [
        "Bhadrabahu — Kalpasutra",
        "Umaswati — Tattvartha Sutra",
        "Kundakunda — Samayasara",
        "Nemichandra — Gommatsara"
      ]
    },
    {
      "label": "Mauryan/foreign",
      "leaves": [
        "Kautilya — Arthashastra",
        "Megasthenes — Indica",
        "Vishakhadatta — Mudrarakshasa",
        "Ashoka — Edicts"
      ]
    },
    {
      "label": "Sangam Tamil",
      "leaves": [
        "Tolkappiyar — grammar",
        "Thiruvalluvar — Tirukkural",
        "Ilango — Silappadikaram",
        "Sathanar — Manimekalai"
      ]
    },
    {
      "label": "Gupta classical",
      "leaves": [
        "Kalidasa — Shakuntalam",
        "Shudraka — Mrichchhakatika",
        "Vishnu Sharma — Panchatantra",
        "Amarasimha — Amarakosha"
      ]
    },
    {
      "label": "Grammar & science",
      "leaves": [
        "Panini — Ashtadhyayi",
        "Patanjali — Mahabhashya",
        "Aryabhata — Aryabhatiya (zero)",
        "Charaka/Sushruta — med/surgery"
      ]
    }
  ]
}
