{
  "kind": "mindmap",
  "subjectCode": "HIST",
  "topic": "Early Vedic Period",
  "subtopicId": "hist-ancient-early-vedic",
  "root": "Early Vedic (Rigvedic)",
  "branches": [
    {
      "label": "Aryans",
      "leaves": [
        "c. 1500 BCE, Indo-Iranian",
        "Max Müller — 'race'",
        "Central Asia homeland",
        "Tilak — Arctic theory"
      ]
    },
    {
      "label": "Sources",
      "leaves": [
        "Rigveda (chief)",
        "Avesta — Iran",
        "Mitanni — Syria",
        "Kassite — Iraq"
      ]
    },
    {
      "label": "Geography",
      "leaves": [
        "Sapta-Sindhu = 7 rivers",
        "Sindhu = Naditama",
        "Ganga once; ~42 rivers",
        "Brahmavarta: Sarasvati–Drishadvati"
      ]
    },
    {
      "label": "Polity",
      "leaves": [
        "Kula→Grama→Visu→Jana",
        "Rajan leads tribe",
        "Sabha & Samiti advise",
        "Dasharajnya (7th Mandala, Ravi)"
      ]
    },
    {
      "label": "Society",
      "leaves": [
        "Gotra-based, patriarchal",
        "Varna = colour first",
        "Purushasukta 10th Mandala",
        "Women respected (Apala/Ghosha)"
      ]
    },
    {
      "label": "Economy",
      "leaves": [
        "Pastoral; cattle prized",
        "Barley & wheat; 4th Mandala",
        "Barter, little trade",
        "Urvara/Langal/Karishu"
      ]
    },
    {
      "label": "Religion",
      "leaves": [
        "Indra — most important",
        "Agni carries offerings",
        "Varuna = Ritashya Gopa",
        "Soma — 9th Mandala"
      ]
    }
  ]
}
