{
  "kind": "mindmap",
  "subjectCode": "HIST",
  "topic": "National Movement in Andhra",
  "subtopicId": "hist-ap-andhra-freedom-movement",
  "root": "Freedom Movement in Andhra",
  "branches": [
    {
      "label": "Early phase",
      "leaves": [
        "Vandemataram 1905–07",
        "B.C. Pal, Rajahmundry 1907",
        "Gadicherla sedition case",
        "Kodi Rammurthy Naidu"
      ]
    },
    {
      "label": "Home Rule/NCM",
      "leaves": [
        "Besant & Tilak Leagues 1916",
        "Non-Cooperation 1920–22",
        "Garimella's songs",
        "Andhra participation"
      ]
    },
    {
      "label": "Rampa 1922–24",
      "leaves": [
        "Alluri Sitarama Raju",
        "1882 Madras Forest Act",
        "Podu curbs, vetti",
        "Killed 7 May 1924"
      ]
    },
    {
      "label": "No-tax struggles",
      "leaves": [
        "Chirala–Perala (Duggirala)",
        "Pedanandipadu (Guntur)",
        "Palnadu Pullari",
        "Kanneganti Hanumanthu"
      ]
    },
    {
      "label": "Leaders",
      "leaves": [
        "Prakasam (Andhra Kesari)",
        "Nageswara Rao (Desoddharaka)",
        "Pattabhi (Tripuri 1939)",
        "Konda Venkatappayya"
      ]
    },
    {
      "label": "Later phase",
      "leaves": [
        "Salt Satyagraha 1930",
        "Quit India 1942",
        "Bhimavaram/Chirala",
        "Durgabai Deshmukh"
      ]
    },
    {
      "label": "Hyderabad State",
      "leaves": [
        "Andhra Jana Sangham 1921",
        "Andhra Mahasabha 1930",
        "Anti-Nizam awakening",
        "Praja Mandal / 1927 AISPC"
      ]
    }
  ]
}
