{
  "kind": "mindmap",
  "subjectCode": "HIST",
  "topic": "Post-Mauryan: Kushanas",
  "subtopicId": "hist-ancient-kushanas",
  "root": "Kushanas",
  "branches": [
    {
      "label": "Origin & rulers",
      "leaves": [
        "Branch of Yuezhi (Yue-Chi)",
        "Kujula Kadphises I — founder",
        "Vima Kadphises II — Shiva, gold",
        "Vasudeva I — last great"
      ]
    },
    {
      "label": "Kanishka I",
      "leaves": [
        "Accession 78 CE = Saka era",
        "Capitals: Purushapura + Mathura",
        "Title 'Devputra'",
        "Rajatarangini records him"
      ]
    },
    {
      "label": "4th Buddhist Council",
      "leaves": [
        "Kundalavana, near Srinagar",
        "President Vasumitra",
        "Deputy Ashvaghosha",
        "Mahayana–Hinayana split"
      ]
    },
    {
      "label": "Art schools",
      "leaves": [
        "Gandhara: grey schist, Greek",
        "Mathura: red sandstone",
        "Amravati: white marble (Satavahana)",
        "Kushanas patron Gandhara+Mathura"
      ]
    },
    {
      "label": "Scholars",
      "leaves": [
        "Ashvaghosha — Buddhacharita",
        "Charaka — Ayurveda",
        "Nagarjuna — Sunyavada",
        "Vatsyayana — Kamasutra"
      ]
    },
    {
      "label": "Economy",
      "leaves": [
        "Silk Route control",
        "Indo-Roman trade + tolls",
        "Gold/silver/copper coins",
        "Roman coin standard"
      ]
    },
    {
      "label": "Admin & decline",
      "leaves": [
        "Mahakshatrapa (satrap)",
        "Dandanayaka; Gramika",
        "Dual hereditary rule",
        "Sassanians overthrow"
      ]
    }
  ]
}
