{
  "kind": "mindmap",
  "subjectCode": "SCI",
  "topic": "Energy Resources & Policy",
  "subtopicId": "sci-energy",
  "root": "Energy & Policy",
  "branches": [
    {
      "label": "Mix & imports",
      "leaves": [
        "Crude oil ~85-88% imported",
        "Coal largest generation (~70%)",
        "3rd-largest consumer",
        "Phase down, not out"
      ]
    },
    {
      "label": "Panchamrit/targets",
      "leaves": [
        "500 GW non-fossil 2030",
        "50% non-fossil hit 2025",
        "Net-zero 2070",
        "Total capacity >500 GW"
      ]
    },
    {
      "label": "Solar & wind",
      "leaves": [
        "PM Surya Ghar Feb'24, 300 units",
        "PM-KUSUM (farm solar)",
        "Solar parks: Bhadla, Pavagada",
        "Wind: Gujarat, Tamil Nadu"
      ]
    },
    {
      "label": "Green hydrogen",
      "leaves": [
        "Mission 2023, ₹19,744 cr",
        "5 MMT/yr by 2030",
        "SIGHT incentives",
        "Green = RE electrolysis"
      ]
    },
    {
      "label": "Nuclear",
      "leaves": [
        "3-stage: PHWR-FBR-Thorium",
        "PFBR Kalpakkam fuel 2024",
        "Mission: SMR ₹20k cr, 100GW'47",
        "AE Act amend. proposed'25-26 (private)"
      ]
    },
    {
      "label": "Efficiency/EV/bio",
      "leaves": [
        "BEE, PAT, UJALA, star",
        "E20 ~2025; SATAT CBG",
        "PM E-DRIVE 2024",
        "BESS + pumped storage"
      ]
    },
    {
      "label": "Andhra Pradesh",
      "leaves": [
        "Pinnapuram PSP (Kurnool)",
        "Kurnool UMSP ~1000 MW",
        "Pudimadaka H2 (Anakapalli)",
        "~14,833 MW; 160 GW by 2047"
      ]
    }
  ]
}